{
  "$schema": "./schema.json",
  "name": {
    "zh-CN": "Anthropic",
    "en": "Anthropic"
  },
  "description": {
    "zh-CN": "Anthropic API 提供最先进的 Claude AI 模型。",
    "en": "Anthropic API provides state-of-the-art Claude AI models."
  },
  "docs": {
    "zh-CN": "https://docs.anthropic.com",
    "en": "https://docs.anthropic.com"
  },
  "dashboard": "https://console.anthropic.com/",
  "endpoints": {
    "default": {
      "anthropic": "https://api.anthropic.com",
      "openai": "https://api.anthropic.com/v1"
    }
  },
  "models": {
    "claude-fable-5": {},
    "claude-fable-5-1": {},
    "claude-haiku-4-5": {},
    "claude-haiku-4-5-20251001": {},
    "claude-haiku-5-5": {},
    "claude-opus-4-5": {},
    "claude-opus-4-5-20251101": {},
    "claude-opus-4-6": {},
    "claude-opus-4-7": {},
    "claude-opus-4-8": {},
    "claude-opus-5": {},
    "claude-opus-5-5": {},
    "claude-sonnet-4-5": {},
    "claude-sonnet-4-5-20250929": {},
    "claude-sonnet-4-6": {},
    "claude-sonnet-5": {},
    "claude-sonnet-5-5": {}
  }
}
