{
  "$schema": "./schema.json",
  "name": {
    "zh-CN": "方舟 Coding Plan",
    "en": "Ark Coding Plan"
  },
  "description": {
    "zh-CN": "方舟 Coding Plan 是为开发者量身定制的订阅服务，助力高效编码开发。",
    "en": "The Ark Coding Plan is a subscription service tailored for developers, designed to enhance efficient coding development."
  },
  "endpoints": {
    "default": {
      "anthropic": "https://ark.cn-beijing.volces.com/api/coding/v1",
      "openai": "https://ark.cn-beijing.volces.com/api/coding/v3"
    }
  },
  "models": {
    "ark-code-latest": {},
    "doubao-seed-2.0-code": {},
    "doubao-seed-2.0-pro": {},
    "doubao-seed-2.0-lite": {},
    "doubao-seed-code": {},
    "minimax-m2.5": {},
    "glm-4.7": {},
    "deepseek-v3.2": {},
    "kimi-k2.5": {}
  }
}
