{
  "$schema": "./schema.json",
  "name": {
    "zh-CN": "OpenAI",
    "en": "OpenAI"
  },
  "description": {
    "zh-CN": "OpenAI API 提供最先进的 AI 模型",
    "en": "OpenAI API provides state-of-the-art AI models."
  },
  "docs": {
    "zh-CN": "https://platform.openai.com/docs",
    "en": "https://platform.openai.com/docs"
  },
  "dashboard": "https://platform.openai.com/",
  "endpoints": {
    "default": {
      "openai": "https://api.openai.com/v1"
    }
  },
  "models": {
    "gpt-3.5-turbo": {},
    "gpt-4": {},
    "gpt-4-turbo": {},
    "gpt-4.1": {},
    "gpt-4.1-mini": {},
    "gpt-4.1-nano": {},
    "gpt-4o": {},
    "gpt-4o-2024-05-13": {},
    "gpt-4o-2024-08-06": {},
    "gpt-4o-2024-11-20": {},
    "gpt-4o-mini": {},
    "gpt-5": {},
    "gpt-5-mini": {},
    "gpt-5-nano": {},
    "gpt-5-pro": {},
    "gpt-5.1": {},
    "gpt-5.2": {},
    "gpt-5.2-pro": {},
    "gpt-5.3-codex": {},
    "gpt-5.3-codex-spark": {},
    "gpt-5.4": {},
    "gpt-5.4-mini": {},
    "gpt-5.4-nano": {},
    "gpt-5.4-pro": {},
    "gpt-5.5": {},
    "gpt-5.5-pro": {},
    "gpt-5.6": {},
    "gpt-5.6-luna": {},
    "gpt-5.6-sol": {},
    "gpt-5.6-terra": {},
    "gpt-6-astra": {},
    "gpt-6-luna": {},
    "gpt-6-sol": {},
    "gpt-6.1-sol": {},
    "gpt-daybreak-blue-latest": {},
    "gpt-daybreak-red-latest": {},
    "gpt-realtime-2.1": {},
    "o1": {},
    "o1-pro": {},
    "o3": {},
    "o3-mini": {},
    "o3-pro": {},
    "o4-mini": {}
  }
}
