{
  "name": {
    "zh-CN": "百炼 Coding Plan",
    "en": "Dashscope Coding Plan"
  },
  "description": {
    "zh-CN": "百炼 Coding Plan 是为开发者量身定制的订阅服务，提供最新最强的编程模型，包括千问系列和优秀的第三方模型。",
    "en": "Dashscope Coding Plan is a subscription service tailored for developers, providing the latest and most powerful programming models, including Qwen series and excellent third-party models."
  },
  "endpoints": {
    "default": {
      "anthropic": "https://coding.dashscope.aliyuncs.com/apps/anthropic",
      "openai": "https://coding.dashscope.aliyuncs.com/v1"
    }
  },
  "models": {
    "qwen3.5-plus": {},
    "qwen3-max-2026-01-23": {},
    "qwen3-coder-next": {},
    "qwen3-coder-plus": {},
    "glm-5": {},
    "glm-4.7": {},
    "kimi-k2.5": {},
    "minimax-m2.5": {}
  }
}